[2025-12-23 02:08:54,983] INFO - ============================================================
[2025-12-23 02:08:54,983] INFO - Run Config
[2025-12-23 02:08:54,983] INFO - Config file: config/mme_local.yaml
[2025-12-23 02:08:54,983] INFO - dataset: {'out_root': './datasets_out', 'hf_endpoint': None, 'dataset_id': 'lmms-lab/MME', 'split': 'test', 'limit': 200}
[2025-12-23 02:08:54,983] INFO - model: {'name': 'Qwen/Qwen2.5-VL-7B-Instruct', 'device_map': 'auto', 'torch_dtype': 'auto', 'max_image_pixels': None, 'use_fast_processor': None}
[2025-12-23 02:08:54,983] INFO - generation: {'max_tokens': 800, 'temperature': 0.2, 'no_retry': False}
[2025-12-23 02:08:54,983] INFO - mme: {'use_choice_extractor': False}
[2025-12-23 02:08:54,983] INFO - _config_path: config/mme_local.yaml
[2025-12-23 02:08:54,983] INFO - ============================================================
[2025-12-23 02:08:54,983] INFO - Dataset prepared: datasets_out/mme/lmms-lab_MME__test__limit200/data.jsonl
[2025-12-23 02:08:54,985] INFO - Resume disabled: pending=200
[2025-12-23 02:09:18,949] INFO - >> [1/200] Start example=mme:0
[2025-12-23 02:09:32,064] INFO - << example=mme:0 ok=True verdict=PASS pred=yes gt=Yes
[2025-12-23 02:09:32,065] INFO - >> [2/200] Start example=mme:1
[2025-12-23 02:09:46,823] INFO - << example=mme:1 ok=True verdict=FAIL pred=no gt=No
[2025-12-23 02:09:46,824] INFO - >> [3/200] Start example=mme:2
[2025-12-23 02:09:56,268] INFO - << example=mme:2 ok=False verdict=PASS pred=no gt=Yes
[2025-12-23 02:09:56,268] INFO - >> [4/200] Start example=mme:3
[2025-12-23 02:10:15,230] WARNING - !! example=mme:3 error=RuntimeError('Failed to get valid JSON for schema=Observation. Last output:\n{\n  "objects": [\n    {\n      "label": "code snippet",\n      "attributes": {\n        "language": "Python"\n      },\n      "relations": [\n        "contains variable assignment",\n        "contains arithmetic operation",\n        "contains print statement"\n      ],\n      "bboxes_xyxy": [\n        [0, 0, 392, 148]\n      ]\n    }\n  ],\n  "ocr_text_blocks": [\n    "a = [1,6,2,7,3,4,5]\\n"\n    "b = a[0] + a[1]\\n"\n    "print(b)"\n  ],\n  "scene_summary": "A Python code snippet is displayed.",\n  "uncertainties": [],\n  "focus_suggestions": []\n}')
Traceback (most recent call last):
  File "/opt/tiger/visual-multi-agent-research/vmas_local_eval.py", line 380, in run_eval
    obs, cand, ver = chain.run_one(question, img_path, choices=choices)
                     ^^^^^^^^^^^^^^^^^^^^^^^^^^^^^^^^^^^^^^^^^^^^^^^^^^
  File "/opt/tiger/visual-multi-agent-research/chains/visual_chain.py", line 530, in run_one
    obs = self.observe(question, image_path)
          ^^^^^^^^^^^^^^^^^^^^^^^^^^^^^^^^^^
  File "/opt/tiger/visual-multi-agent-research/chains/visual_chain.py", line 471, in observe
    obs = call_structured_json(
          ^^^^^^^^^^^^^^^^^^^^^
  File "/opt/tiger/visual-multi-agent-research/chains/visual_chain.py", line 394, in call_structured_json
    raise RuntimeError(
RuntimeError: Failed to get valid JSON for schema=Observation. Last output:
{
  "objects": [
    {
      "label": "code snippet",
      "attributes": {
        "language": "Python"
      },
      "relations": [
        "contains variable assignment",
        "contains arithmetic operation",
        "contains print statement"
      ],
      "bboxes_xyxy": [
        [0, 0, 392, 148]
      ]
    }
  ],
  "ocr_text_blocks": [
    "a = [1,6,2,7,3,4,5]\n"
    "b = a[0] + a[1]\n"
    "print(b)"
  ],
  "scene_summary": "A Python code snippet is displayed.",
  "uncertainties": [],
  "focus_suggestions": []
}
[2025-12-23 02:10:15,231] INFO - >> [5/200] Start example=mme:4
[2025-12-23 02:10:35,380] INFO - << example=mme:4 ok=False verdict=FAIL pred=no gt=Yes
[2025-12-23 02:10:35,381] INFO - >> [6/200] Start example=mme:5
[2025-12-23 02:10:51,441] INFO - << example=mme:5 ok=True verdict=FAIL pred=no gt=No
[2025-12-23 02:10:51,441] INFO - >> [7/200] Start example=mme:6
[2025-12-23 02:11:08,252] INFO - << example=mme:6 ok=False verdict=FAIL pred=no gt=Yes
[2025-12-23 02:11:08,252] INFO - >> [8/200] Start example=mme:7
[2025-12-23 02:11:24,866] INFO - << example=mme:7 ok=False verdict=FAIL pred=yes gt=No
[2025-12-23 02:11:24,866] INFO - >> [9/200] Start example=mme:8
[2025-12-23 02:11:37,027] INFO - << example=mme:8 ok=False verdict=FAIL pred=no gt=Yes
[2025-12-23 02:11:37,028] INFO - >> [10/200] Start example=mme:9
[2025-12-23 02:11:41,946] INFO - << example=mme:9 ok=True verdict=PASS pred=no gt=No
[2025-12-23 02:11:41,946] INFO - >> [11/200] Start example=mme:10
[2025-12-23 02:11:46,676] INFO - << example=mme:10 ok=True verdict=PASS pred=yes gt=Yes
[2025-12-23 02:11:46,677] INFO - >> [12/200] Start example=mme:11
[2025-12-23 02:11:59,775] INFO - << example=mme:11 ok=True verdict=FAIL pred=no gt=No
[2025-12-23 02:11:59,775] INFO - >> [13/200] Start example=mme:12
[2025-12-23 02:12:08,588] INFO - << example=mme:12 ok=False verdict=PASS pred=no gt=Yes
[2025-12-23 02:12:08,588] INFO - >> [14/200] Start example=mme:13
[2025-12-23 02:12:33,045] INFO - << example=mme:13 ok=True verdict=FAIL pred=no gt=No
[2025-12-23 02:12:33,046] INFO - >> [15/200] Start example=mme:14
[2025-12-23 02:12:50,049] INFO - << example=mme:14 ok=True verdict=FAIL pred=yes gt=Yes
[2025-12-23 02:12:50,049] INFO - >> [16/200] Start example=mme:15
[2025-12-23 02:13:08,330] INFO - << example=mme:15 ok=True verdict=FAIL pred=no gt=No
[2025-12-23 02:13:08,330] INFO - >> [17/200] Start example=mme:16
[2025-12-23 02:13:15,703] INFO - << example=mme:16 ok=True verdict=PASS pred=yes gt=Yes
[2025-12-23 02:13:15,704] INFO - >> [18/200] Start example=mme:17
[2025-12-23 02:13:23,698] INFO - << example=mme:17 ok=True verdict=PASS pred=no gt=No
[2025-12-23 02:13:23,699] INFO - >> [19/200] Start example=mme:18
[2025-12-23 02:13:30,023] INFO - << example=mme:18 ok=True verdict=PASS pred=yes gt=Yes
[2025-12-23 02:13:30,023] INFO - >> [20/200] Start example=mme:19
[2025-12-23 02:13:44,633] INFO - << example=mme:19 ok=True verdict=FAIL pred=no gt=No
[2025-12-23 02:13:44,634] INFO - >> [21/200] Start example=mme:20
[2025-12-23 02:14:00,521] INFO - << example=mme:20 ok=False verdict=FAIL pred=no gt=Yes
[2025-12-23 02:14:00,522] INFO - >> [22/200] Start example=mme:21
[2025-12-23 02:14:10,767] INFO - << example=mme:21 ok=True verdict=PASS pred=no gt=No
[2025-12-23 02:14:10,767] INFO - >> [23/200] Start example=mme:22
[2025-12-23 02:14:20,934] INFO - << example=mme:22 ok=False verdict=PASS pred=no gt=Yes
[2025-12-23 02:14:20,934] INFO - >> [24/200] Start example=mme:23
[2025-12-23 02:14:48,607] WARNING - !! example=mme:23 error=RuntimeError('Failed to get valid JSON for schema=Observation. Last output:\n{\n  "objects": [\n    {\n      "label": "Python code",\n      "attributes": {\n        "language": "Python"\n      },\n      "relations": [\n        "contains variable assignment",\n        "contains loop structure",\n        "contains print statement"\n      ],\n      "bboxes_xyxy": [\n        [46, 30, 298, 170]\n      ]\n    }\n  ],\n  "ocr_text_blocks": [\n    "a = [1,2,4,5]\\n"\n    "r = 0\\n"\n    "for x in a:\\n"\n    "    r = r + x\\n"\n    "print(r)"\n  ],\n  "scene_summary": "A Python script is shown.",\n  "uncertainties": [],\n  "focus_suggestions": []\n}')
Traceback (most recent call last):
  File "/opt/tiger/visual-multi-agent-research/vmas_local_eval.py", line 380, in run_eval
    obs, cand, ver = chain.run_one(question, img_path, choices=choices)
                     ^^^^^^^^^^^^^^^^^^^^^^^^^^^^^^^^^^^^^^^^^^^^^^^^^^
  File "/opt/tiger/visual-multi-agent-research/chains/visual_chain.py", line 536, in run_one
    obs2 = self.observe(question, image_path, extra_focus=focus)
           ^^^^^^^^^^^^^^^^^^^^^^^^^^^^^^^^^^^^^^^^^^^^^^^^^^^^^
  File "/opt/tiger/visual-multi-agent-research/chains/visual_chain.py", line 471, in observe
    obs = call_structured_json(
          ^^^^^^^^^^^^^^^^^^^^^
  File "/opt/tiger/visual-multi-agent-research/chains/visual_chain.py", line 394, in call_structured_json
    raise RuntimeError(
RuntimeError: Failed to get valid JSON for schema=Observation. Last output:
{
  "objects": [
    {
      "label": "Python code",
      "attributes": {
        "language": "Python"
      },
      "relations": [
        "contains variable assignment",
        "contains loop structure",
        "contains print statement"
      ],
      "bboxes_xyxy": [
        [46, 30, 298, 170]
      ]
    }
  ],
  "ocr_text_blocks": [
    "a = [1,2,4,5]\n"
    "r = 0\n"
    "for x in a:\n"
    "    r = r + x\n"
    "print(r)"
  ],
  "scene_summary": "A Python script is shown.",
  "uncertainties": [],
  "focus_suggestions": []
}
[2025-12-23 02:14:48,608] INFO - >> [25/200] Start example=mme:24
[2025-12-23 02:15:00,573] INFO - << example=mme:24 ok=False verdict=FAIL pred=no gt=Yes
[2025-12-23 02:15:00,573] INFO - >> [26/200] Start example=mme:25
[2025-12-23 02:15:07,075] INFO - << example=mme:25 ok=True verdict=PASS pred=no gt=No
[2025-12-23 02:15:07,076] INFO - >> [27/200] Start example=mme:26
[2025-12-23 02:15:14,250] INFO - << example=mme:26 ok=True verdict=PASS pred=yes gt=Yes
[2025-12-23 02:15:14,251] INFO - >> [28/200] Start example=mme:27
[2025-12-23 02:15:30,072] INFO - << example=mme:27 ok=True verdict=PASS pred=no gt=No
[2025-12-23 02:15:30,072] INFO - >> [29/200] Start example=mme:28
[2025-12-23 02:15:46,132] INFO - << example=mme:28 ok=False verdict=FAIL pred=no gt=Yes
[2025-12-23 02:15:46,133] INFO - >> [30/200] Start example=mme:29
[2025-12-23 02:16:00,670] INFO - << example=mme:29 ok=True verdict=FAIL pred=no gt=No
[2025-12-23 02:16:00,670] INFO - >> [31/200] Start example=mme:30
[2025-12-23 02:16:21,377] INFO - << example=mme:30 ok=False verdict=FAIL pred=no gt=Yes
[2025-12-23 02:16:21,378] INFO - >> [32/200] Start example=mme:31
[2025-12-23 02:16:42,878] INFO - << example=mme:31 ok=True verdict=FAIL pred=no gt=No
[2025-12-23 02:16:42,878] INFO - >> [33/200] Start example=mme:32
[2025-12-23 02:16:58,040] INFO - << example=mme:32 ok=False verdict=FAIL pred=no gt=Yes
[2025-12-23 02:16:58,041] INFO - >> [34/200] Start example=mme:33
[2025-12-23 02:17:11,576] INFO - << example=mme:33 ok=True verdict=FAIL pred=no gt=No
[2025-12-23 02:17:11,577] INFO - >> [35/200] Start example=mme:34
[2025-12-23 02:17:21,101] INFO - << example=mme:34 ok=False verdict=PASS pred=no gt=Yes
[2025-12-23 02:17:21,101] INFO - >> [36/200] Start example=mme:35
[2025-12-23 02:17:27,833] INFO - << example=mme:35 ok=True verdict=PASS pred=no gt=No
[2025-12-23 02:17:27,833] INFO - >> [37/200] Start example=mme:36
[2025-12-23 02:17:40,189] INFO - << example=mme:36 ok=False verdict=FAIL pred=no gt=Yes
[2025-12-23 02:17:40,189] INFO - >> [38/200] Start example=mme:37
[2025-12-23 02:17:52,556] INFO - << example=mme:37 ok=True verdict=PASS pred=no gt=No
[2025-12-23 02:17:52,556] INFO - >> [39/200] Start example=mme:38
[2025-12-23 02:18:04,685] INFO - << example=mme:38 ok=False verdict=FAIL pred=no gt=Yes
[2025-12-23 02:18:04,686] INFO - >> [40/200] Start example=mme:39
[2025-12-23 02:18:16,202] INFO - << example=mme:39 ok=True verdict=PASS pred=no gt=No
[2025-12-23 02:18:16,202] INFO - >> [41/200] Start example=mme:40
[2025-12-23 02:18:21,223] INFO - << example=mme:40 ok=True verdict=PASS pred=yes gt=Yes
[2025-12-23 02:18:21,223] INFO - >> [42/200] Start example=mme:41
[2025-12-23 02:18:32,147] INFO - << example=mme:41 ok=False verdict=FAIL pred=yes gt=No
[2025-12-23 02:18:32,148] INFO - >> [43/200] Start example=mme:42
[2025-12-23 02:18:46,811] INFO - << example=mme:42 ok=False verdict=FAIL pred=no gt=Yes
[2025-12-23 02:18:46,812] INFO - >> [44/200] Start example=mme:43
[2025-12-23 02:18:58,294] INFO - << example=mme:43 ok=True verdict=FAIL pred=no gt=No
[2025-12-23 02:18:58,294] INFO - >> [45/200] Start example=mme:44
[2025-12-23 02:19:12,621] INFO - << example=mme:44 ok=False verdict=FAIL pred=no gt=Yes
[2025-12-23 02:19:12,622] INFO - >> [46/200] Start example=mme:45
[2025-12-23 02:19:28,515] INFO - << example=mme:45 ok=True verdict=FAIL pred=no gt=No
[2025-12-23 02:19:28,516] INFO - >> [47/200] Start example=mme:46
[2025-12-23 02:19:43,665] INFO - << example=mme:46 ok=False verdict=FAIL pred=no gt=Yes
[2025-12-23 02:19:43,665] INFO - >> [48/200] Start example=mme:47
[2025-12-23 02:19:57,674] INFO - << example=mme:47 ok=True verdict=FAIL pred=no gt=No
[2025-12-23 02:19:57,675] INFO - >> [49/200] Start example=mme:48
[2025-12-23 02:20:03,773] INFO - << example=mme:48 ok=True verdict=PASS pred=yes gt=Yes
[2025-12-23 02:20:03,773] INFO - >> [50/200] Start example=mme:49
[2025-12-23 02:20:17,615] INFO - << example=mme:49 ok=True verdict=FAIL pred=no gt=No
[2025-12-23 02:20:17,615] INFO - >> [51/200] Start example=mme:50
[2025-12-23 02:20:22,796] INFO - << example=mme:50 ok=True verdict=PASS pred=yes gt=Yes
[2025-12-23 02:20:22,796] INFO - >> [52/200] Start example=mme:51
[2025-12-23 02:20:33,424] INFO - << example=mme:51 ok=True verdict=FAIL pred=no gt=No
[2025-12-23 02:20:33,425] INFO - >> [53/200] Start example=mme:52
[2025-12-23 02:20:39,952] INFO - << example=mme:52 ok=True verdict=PASS pred=yes gt=Yes
[2025-12-23 02:20:39,952] INFO - >> [54/200] Start example=mme:53
[2025-12-23 02:20:53,929] INFO - << example=mme:53 ok=True verdict=FAIL pred=no gt=No
[2025-12-23 02:20:53,929] INFO - >> [55/200] Start example=mme:54
[2025-12-23 02:20:59,425] INFO - << example=mme:54 ok=True verdict=PASS pred=yes gt=Yes
[2025-12-23 02:20:59,425] INFO - >> [56/200] Start example=mme:55
[2025-12-23 02:21:05,123] INFO - << example=mme:55 ok=False verdict=PASS pred=yes gt=No
[2025-12-23 02:21:05,123] INFO - >> [57/200] Start example=mme:56
[2025-12-23 02:21:11,431] INFO - << example=mme:56 ok=True verdict=PASS pred=yes gt=Yes
[2025-12-23 02:21:11,431] INFO - >> [58/200] Start example=mme:57
[2025-12-23 02:21:25,540] INFO - << example=mme:57 ok=True verdict=PASS pred=no gt=No
[2025-12-23 02:21:25,541] INFO - >> [59/200] Start example=mme:58
[2025-12-23 02:21:54,268] WARNING - !! example=mme:58 error=RuntimeError('Failed to get valid JSON for schema=VerificationResult. Last output:\n{\n  "verdict": "FAIL",\n  "error_type": "answer_mapping",\n  "issues": ["The candidate answer \'no\' is not supported by the image. The image shows a religious painting with figures that resemble the Holy Family, which might suggest it could be from the Renaissance period, but there is no explicit textual confirmation of the artist\'s name as Frangipane or the artist Niccolò Frangipane.",\n  "fix_hint": "The candidate should consider the visual elements and historical context of the painting to make a more informed decision.",\n  "should_retry": true\n}')
Traceback (most recent call last):
  File "/opt/tiger/visual-multi-agent-research/vmas_local_eval.py", line 380, in run_eval
    obs, cand, ver = chain.run_one(question, img_path, choices=choices)
                     ^^^^^^^^^^^^^^^^^^^^^^^^^^^^^^^^^^^^^^^^^^^^^^^^^^
  File "/opt/tiger/visual-multi-agent-research/chains/visual_chain.py", line 538, in run_one
    ver2 = self.verify(question, image_path, obs2, cand2, choices=choices)
           ^^^^^^^^^^^^^^^^^^^^^^^^^^^^^^^^^^^^^^^^^^^^^^^^^^^^^^^^^^^^^^^
  File "/opt/tiger/visual-multi-agent-research/chains/visual_chain.py", line 514, in verify
    return call_structured_json(
           ^^^^^^^^^^^^^^^^^^^^^
  File "/opt/tiger/visual-multi-agent-research/chains/visual_chain.py", line 394, in call_structured_json
    raise RuntimeError(
RuntimeError: Failed to get valid JSON for schema=VerificationResult. Last output:
{
  "verdict": "FAIL",
  "error_type": "answer_mapping",
  "issues": ["The candidate answer 'no' is not supported by the image. The image shows a religious painting with figures that resemble the Holy Family, which might suggest it could be from the Renaissance period, but there is no explicit textual confirmation of the artist's name as Frangipane or the artist Niccolò Frangipane.",
  "fix_hint": "The candidate should consider the visual elements and historical context of the painting to make a more informed decision.",
  "should_retry": true
}
[2025-12-23 02:21:54,269] INFO - >> [60/200] Start example=mme:59
[2025-12-23 02:22:10,652] INFO - << example=mme:59 ok=True verdict=FAIL pred=no gt=No
[2025-12-23 02:22:10,653] INFO - >> [61/200] Start example=mme:60
[2025-12-23 02:22:27,511] INFO - << example=mme:60 ok=False verdict=FAIL pred=no gt=Yes
[2025-12-23 02:22:27,511] INFO - >> [62/200] Start example=mme:61
[2025-12-23 02:22:42,740] INFO - << example=mme:61 ok=True verdict=FAIL pred=no gt=No
[2025-12-23 02:22:42,740] INFO - >> [63/200] Start example=mme:62
[2025-12-23 02:22:51,197] INFO - << example=mme:62 ok=True verdict=PASS pred=yes gt=Yes
[2025-12-23 02:22:51,197] INFO - >> [64/200] Start example=mme:63
[2025-12-23 02:23:04,132] INFO - << example=mme:63 ok=True verdict=FAIL pred=no gt=No
[2025-12-23 02:23:04,132] INFO - >> [65/200] Start example=mme:64
[2025-12-23 02:23:10,086] INFO - << example=mme:64 ok=True verdict=PASS pred=yes gt=Yes
[2025-12-23 02:23:10,087] INFO - >> [66/200] Start example=mme:65
[2025-12-23 02:23:23,571] INFO - << example=mme:65 ok=True verdict=PASS pred=no gt=No
[2025-12-23 02:23:23,571] INFO - >> [67/200] Start example=mme:66
[2025-12-23 02:23:37,734] INFO - << example=mme:66 ok=False verdict=FAIL pred=no gt=Yes
[2025-12-23 02:23:37,734] INFO - >> [68/200] Start example=mme:67
[2025-12-23 02:23:52,652] INFO - << example=mme:67 ok=True verdict=FAIL pred=no gt=No
[2025-12-23 02:23:52,652] INFO - >> [69/200] Start example=mme:68
[2025-12-23 02:24:12,395] INFO - << example=mme:68 ok=False verdict=FAIL pred=no gt=Yes
[2025-12-23 02:24:12,395] INFO - >> [70/200] Start example=mme:69
[2025-12-23 02:24:36,107] INFO - << example=mme:69 ok=True verdict=FAIL pred=no gt=No
[2025-12-23 02:24:36,107] INFO - >> [71/200] Start example=mme:70
[2025-12-23 02:24:54,595] INFO - << example=mme:70 ok=False verdict=FAIL pred=no gt=Yes
[2025-12-23 02:24:54,596] INFO - >> [72/200] Start example=mme:71
[2025-12-23 02:25:09,062] INFO - << example=mme:71 ok=True verdict=FAIL pred=no gt=No
[2025-12-23 02:25:09,062] INFO - >> [73/200] Start example=mme:72
[2025-12-23 02:25:14,123] INFO - << example=mme:72 ok=True verdict=PASS pred=yes gt=Yes
[2025-12-23 02:25:14,123] INFO - >> [74/200] Start example=mme:73
[2025-12-23 02:25:19,845] INFO - << example=mme:73 ok=True verdict=PASS pred=no gt=No
[2025-12-23 02:25:19,845] INFO - >> [75/200] Start example=mme:74
[2025-12-23 02:25:32,927] INFO - << example=mme:74 ok=False verdict=FAIL pred=no gt=Yes
[2025-12-23 02:25:32,928] INFO - >> [76/200] Start example=mme:75
[2025-12-23 02:25:44,669] INFO - << example=mme:75 ok=True verdict=FAIL pred=no gt=No
[2025-12-23 02:25:44,669] INFO - >> [77/200] Start example=mme:76
[2025-12-23 02:26:03,480] INFO - << example=mme:76 ok=False verdict=FAIL pred=no gt=Yes
[2025-12-23 02:26:03,480] INFO - >> [78/200] Start example=mme:77
[2025-12-23 02:26:19,798] INFO - << example=mme:77 ok=True verdict=FAIL pred=no gt=No
[2025-12-23 02:26:19,799] INFO - >> [79/200] Start example=mme:78
[2025-12-23 02:26:25,508] INFO - << example=mme:78 ok=True verdict=PASS pred=yes gt=Yes
[2025-12-23 02:26:25,508] INFO - >> [80/200] Start example=mme:79
[2025-12-23 02:26:29,149] INFO - << example=mme:79 ok=True verdict=PASS pred=no gt=No
[2025-12-23 02:26:29,149] INFO - >> [81/200] Start example=mme:80
[2025-12-23 02:26:44,083] INFO - << example=mme:80 ok=False verdict=FAIL pred=no gt=Yes
[2025-12-23 02:26:44,083] INFO - >> [82/200] Start example=mme:81
[2025-12-23 02:26:56,676] INFO - << example=mme:81 ok=True verdict=FAIL pred=no gt=No
[2025-12-23 02:26:56,676] INFO - >> [83/200] Start example=mme:82
[2025-12-23 02:27:03,628] INFO - << example=mme:82 ok=True verdict=PASS pred=yes gt=Yes
[2025-12-23 02:27:03,628] INFO - >> [84/200] Start example=mme:83
[2025-12-23 02:27:09,419] INFO - << example=mme:83 ok=False verdict=PASS pred=yes gt=No
[2025-12-23 02:27:09,419] INFO - >> [85/200] Start example=mme:84
[2025-12-23 02:27:14,983] INFO - << example=mme:84 ok=True verdict=PASS pred=yes gt=Yes
[2025-12-23 02:27:14,984] INFO - >> [86/200] Start example=mme:85
[2025-12-23 02:27:30,575] INFO - << example=mme:85 ok=True verdict=FAIL pred=no gt=No
[2025-12-23 02:27:30,575] INFO - >> [87/200] Start example=mme:86
[2025-12-23 02:27:45,257] INFO - << example=mme:86 ok=False verdict=FAIL pred=no gt=Yes
[2025-12-23 02:27:45,257] INFO - >> [88/200] Start example=mme:87
[2025-12-23 02:27:57,167] INFO - << example=mme:87 ok=True verdict=FAIL pred=no gt=No
[2025-12-23 02:27:57,168] INFO - >> [89/200] Start example=mme:88
[2025-12-23 02:28:11,992] INFO - << example=mme:88 ok=False verdict=FAIL pred=no gt=Yes
[2025-12-23 02:28:11,992] INFO - >> [90/200] Start example=mme:89
[2025-12-23 02:28:27,484] INFO - << example=mme:89 ok=True verdict=FAIL pred=no gt=No
[2025-12-23 02:28:27,484] INFO - >> [91/200] Start example=mme:90
[2025-12-23 02:28:46,785] INFO - << example=mme:90 ok=True verdict=FAIL pred=yes gt=Yes
[2025-12-23 02:28:46,785] INFO - >> [92/200] Start example=mme:91
[2025-12-23 02:29:00,200] INFO - << example=mme:91 ok=True verdict=PASS pred=no gt=No
[2025-12-23 02:29:00,200] INFO - >> [93/200] Start example=mme:92
[2025-12-23 02:29:15,803] INFO - << example=mme:92 ok=True verdict=PASS pred=yes gt=Yes
[2025-12-23 02:29:15,803] INFO - >> [94/200] Start example=mme:93
[2025-12-23 02:29:32,131] INFO - << example=mme:93 ok=False verdict=FAIL pred=yes gt=No
[2025-12-23 02:29:32,131] INFO - >> [95/200] Start example=mme:94
[2025-12-23 02:29:50,874] INFO - << example=mme:94 ok=False verdict=FAIL pred=no gt=Yes
[2025-12-23 02:29:50,874] INFO - >> [96/200] Start example=mme:95
[2025-12-23 02:30:05,286] INFO - << example=mme:95 ok=True verdict=FAIL pred=no gt=No
[2025-12-23 02:30:05,286] INFO - >> [97/200] Start example=mme:96
[2025-12-23 02:30:20,934] INFO - << example=mme:96 ok=False verdict=FAIL pred=no gt=Yes
[2025-12-23 02:30:20,934] INFO - >> [98/200] Start example=mme:97
[2025-12-23 02:30:36,400] INFO - << example=mme:97 ok=True verdict=FAIL pred=no gt=No
[2025-12-23 02:30:36,400] INFO - >> [99/200] Start example=mme:98
[2025-12-23 02:30:49,650] INFO - << example=mme:98 ok=True verdict=PASS pred=yes gt=Yes
[2025-12-23 02:30:49,650] INFO - >> [100/200] Start example=mme:99
[2025-12-23 02:30:53,340] INFO - << example=mme:99 ok=False verdict=PASS pred=yes gt=No
[2025-12-23 02:30:53,340] INFO - >> [101/200] Start example=mme:100
[2025-12-23 02:30:58,623] INFO - << example=mme:100 ok=True verdict=PASS pred=yes gt=Yes
[2025-12-23 02:30:58,623] INFO - >> [102/200] Start example=mme:101
[2025-12-23 02:31:16,428] INFO - << example=mme:101 ok=True verdict=FAIL pred=no gt=No
[2025-12-23 02:31:16,428] INFO - >> [103/200] Start example=mme:102
[2025-12-23 02:31:22,322] INFO - << example=mme:102 ok=False verdict=PASS pred=no gt=Yes
[2025-12-23 02:31:22,323] INFO - >> [104/200] Start example=mme:103
[2025-12-23 02:31:37,072] INFO - << example=mme:103 ok=True verdict=FAIL pred=no gt=No
[2025-12-23 02:31:37,073] INFO - >> [105/200] Start example=mme:104
[2025-12-23 02:31:54,160] INFO - << example=mme:104 ok=False verdict=FAIL pred=no gt=Yes
[2025-12-23 02:31:54,160] INFO - >> [106/200] Start example=mme:105
[2025-12-23 02:32:11,303] INFO - << example=mme:105 ok=True verdict=FAIL pred=no gt=No
[2025-12-23 02:32:11,303] INFO - >> [107/200] Start example=mme:106
[2025-12-23 02:32:29,901] INFO - << example=mme:106 ok=True verdict=PASS pred=yes gt=Yes
[2025-12-23 02:32:29,901] INFO - >> [108/200] Start example=mme:107
[2025-12-23 02:32:44,639] INFO - << example=mme:107 ok=True verdict=FAIL pred=no gt=No
[2025-12-23 02:32:44,639] INFO - >> [109/200] Start example=mme:108
[2025-12-23 02:32:59,768] INFO - << example=mme:108 ok=True verdict=PASS pred=yes gt=Yes
[2025-12-23 02:32:59,768] INFO - >> [110/200] Start example=mme:109
[2025-12-23 02:33:19,762] INFO - << example=mme:109 ok=True verdict=FAIL pred=no gt=No
[2025-12-23 02:33:19,762] INFO - >> [111/200] Start example=mme:110
[2025-12-23 02:33:26,284] INFO - << example=mme:110 ok=True verdict=PASS pred=yes gt=Yes
[2025-12-23 02:33:26,284] INFO - >> [112/200] Start example=mme:111
[2025-12-23 02:33:40,297] INFO - << example=mme:111 ok=True verdict=FAIL pred=no gt=No
[2025-12-23 02:33:40,297] INFO - >> [113/200] Start example=mme:112
[2025-12-23 02:33:53,468] INFO - << example=mme:112 ok=False verdict=PASS pred=no gt=Yes
[2025-12-23 02:33:53,468] INFO - >> [114/200] Start example=mme:113
[2025-12-23 02:34:16,269] INFO - << example=mme:113 ok=True verdict=FAIL pred=no gt=No
[2025-12-23 02:34:16,269] INFO - >> [115/200] Start example=mme:114
[2025-12-23 02:34:21,416] INFO - << example=mme:114 ok=True verdict=PASS pred=yes gt=Yes
[2025-12-23 02:34:21,416] INFO - >> [116/200] Start example=mme:115
[2025-12-23 02:34:26,679] INFO - << example=mme:115 ok=False verdict=PASS pred=yes gt=No
[2025-12-23 02:34:26,679] INFO - >> [117/200] Start example=mme:116
[2025-12-23 02:34:32,471] INFO - << example=mme:116 ok=True verdict=PASS pred=yes gt=Yes
[2025-12-23 02:34:32,471] INFO - >> [118/200] Start example=mme:117
[2025-12-23 02:34:39,758] INFO - << example=mme:117 ok=False verdict=PASS pred=yes gt=No
[2025-12-23 02:34:39,758] INFO - >> [119/200] Start example=mme:118
[2025-12-23 02:34:58,024] INFO - << example=mme:118 ok=False verdict=FAIL pred=no gt=Yes
[2025-12-23 02:34:58,024] INFO - >> [120/200] Start example=mme:119
[2025-12-23 02:35:16,996] INFO - << example=mme:119 ok=True verdict=FAIL pred=no gt=No
[2025-12-23 02:35:16,996] INFO - >> [121/200] Start example=mme:120
[2025-12-23 02:35:35,079] INFO - << example=mme:120 ok=False verdict=FAIL pred=no gt=Yes
[2025-12-23 02:35:35,079] INFO - >> [122/200] Start example=mme:121
[2025-12-23 02:35:47,789] INFO - << example=mme:121 ok=True verdict=FAIL pred=no gt=No
[2025-12-23 02:35:47,789] INFO - >> [123/200] Start example=mme:122
[2025-12-23 02:35:53,579] INFO - << example=mme:122 ok=True verdict=PASS pred=yes gt=Yes
[2025-12-23 02:35:53,579] INFO - >> [124/200] Start example=mme:123
[2025-12-23 02:35:58,984] INFO - << example=mme:123 ok=False verdict=PASS pred=yes gt=No
[2025-12-23 02:35:58,985] INFO - >> [125/200] Start example=mme:124
[2025-12-23 02:36:18,108] INFO - << example=mme:124 ok=False verdict=FAIL pred=no gt=Yes
[2025-12-23 02:36:18,108] INFO - >> [126/200] Start example=mme:125
[2025-12-23 02:36:21,710] INFO - << example=mme:125 ok=True verdict=PASS pred=no gt=No
[2025-12-23 02:36:21,710] INFO - >> [127/200] Start example=mme:126
[2025-12-23 02:36:26,962] INFO - << example=mme:126 ok=True verdict=PASS pred=yes gt=Yes
[2025-12-23 02:36:26,962] INFO - >> [128/200] Start example=mme:127
[2025-12-23 02:36:39,672] INFO - << example=mme:127 ok=True verdict=FAIL pred=no gt=No
[2025-12-23 02:36:39,673] INFO - >> [129/200] Start example=mme:128
[2025-12-23 02:36:45,245] INFO - << example=mme:128 ok=False verdict=PASS pred=no gt=Yes
[2025-12-23 02:36:45,245] INFO - >> [130/200] Start example=mme:129
[2025-12-23 02:36:56,430] INFO - << example=mme:129 ok=True verdict=FAIL pred=no gt=No
[2025-12-23 02:36:56,430] INFO - >> [131/200] Start example=mme:130
[2025-12-23 02:37:08,891] INFO - << example=mme:130 ok=True verdict=PASS pred=yes gt=Yes
[2025-12-23 02:37:08,892] INFO - >> [132/200] Start example=mme:131
[2025-12-23 02:37:26,474] INFO - << example=mme:131 ok=True verdict=FAIL pred=no gt=No
[2025-12-23 02:37:26,475] INFO - >> [133/200] Start example=mme:132
[2025-12-23 02:37:38,222] INFO - << example=mme:132 ok=False verdict=FAIL pred=no gt=Yes
[2025-12-23 02:37:38,222] INFO - >> [134/200] Start example=mme:133
[2025-12-23 02:37:52,803] INFO - << example=mme:133 ok=True verdict=FAIL pred=no gt=No
[2025-12-23 02:37:52,804] INFO - >> [135/200] Start example=mme:134
[2025-12-23 02:38:06,396] INFO - << example=mme:134 ok=False verdict=FAIL pred=no gt=Yes
[2025-12-23 02:38:06,396] INFO - >> [136/200] Start example=mme:135
[2025-12-23 02:38:22,239] INFO - << example=mme:135 ok=True verdict=FAIL pred=no gt=No
[2025-12-23 02:38:22,239] INFO - >> [137/200] Start example=mme:136
[2025-12-23 02:38:26,734] INFO - << example=mme:136 ok=True verdict=PASS pred=yes gt=Yes
[2025-12-23 02:38:26,734] INFO - >> [138/200] Start example=mme:137
[2025-12-23 02:38:44,663] INFO - << example=mme:137 ok=True verdict=FAIL pred=no gt=No
[2025-12-23 02:38:44,664] INFO - >> [139/200] Start example=mme:138
[2025-12-23 02:38:49,875] INFO - << example=mme:138 ok=True verdict=PASS pred=yes gt=Yes
[2025-12-23 02:38:49,876] INFO - >> [140/200] Start example=mme:139
[2025-12-23 02:38:54,858] INFO - << example=mme:139 ok=False verdict=PASS pred=yes gt=No
[2025-12-23 02:38:54,859] INFO - >> [141/200] Start example=mme:140
[2025-12-23 02:38:59,378] INFO - << example=mme:140 ok=True verdict=PASS pred=yes gt=Yes
[2025-12-23 02:38:59,378] INFO - >> [142/200] Start example=mme:141
[2025-12-23 02:39:12,710] INFO - << example=mme:141 ok=True verdict=FAIL pred=no gt=No
[2025-12-23 02:39:12,710] INFO - >> [143/200] Start example=mme:142
[2025-12-23 02:39:16,253] INFO - << example=mme:142 ok=True verdict=PASS pred=yes gt=Yes
[2025-12-23 02:39:16,254] INFO - >> [144/200] Start example=mme:143
[2025-12-23 02:39:24,324] INFO - << example=mme:143 ok=True verdict=FAIL pred=no gt=No
[2025-12-23 02:39:24,324] INFO - >> [145/200] Start example=mme:144
[2025-12-23 02:39:29,235] INFO - << example=mme:144 ok=True verdict=PASS pred=yes gt=Yes
[2025-12-23 02:39:29,235] INFO - >> [146/200] Start example=mme:145
[2025-12-23 02:39:43,609] INFO - << example=mme:145 ok=True verdict=FAIL pred=no gt=No
[2025-12-23 02:39:43,610] INFO - >> [147/200] Start example=mme:146
[2025-12-23 02:39:50,681] INFO - << example=mme:146 ok=True verdict=PASS pred=yes gt=Yes
[2025-12-23 02:39:50,681] INFO - >> [148/200] Start example=mme:147
[2025-12-23 02:41:18,757] WARNING - !! example=mme:147 error=RuntimeError('Failed to get valid JSON for schema=Observation. Last output:\n{\n  "objects": [\n    {\n      "label": "Relief sculpture",\n      "attributes": {\n        "material": ["bronze"],\n        "style": ["medieval"],\n        "subject": ["religious scene"]\n      },\n      "count": 1,\n      "bbox_xyxy": [0, 0, 1119, 812],\n      "relations": ["depicts religious figures", "showing crucifixion"],\n      "bboxes_xyxy": []\n    }\n  ],\n  "ocr_text_blocks": [\n    "ANNO MILLENO CEISENO SEPTAGENO: OCVAO SCULBOR PATZISOXSEZDO",\n    "GABRIELI",\n    "SALVATORE DARIO",\n    "OBEDIENTE",\n    "SALVATORE DARIO",\n    "OBEDIENTE",\n    "SALVATORE DARIO",\n    "OBEDIENTE",\n    "SALVATORE DARIO",\n    "OBEDIENTE",\n    "SALVATORE DARIO",\n    "OBEDIENTE",\n    "SALVATORE DARIO",\n    "OBEDIENTE",\n    "SALVATORE DARIO",\n    "OBEDIENTE",\n    "SALVATORE DARIO",\n    "OBEDIENTE",\n    "SALVATORE DARIO",\n    "OBEDIENTE",\n    "SALVATORE DARIO",\n    "OBEDIENTE",\n    "SALVATORE DARIO",\n    "OBEDIENTE",\n    "SALVATORE DARIO",\n    "OBEDIENTE",\n    "SALVATORE DARIO",\n    "OBEDIENTE",\n    "SALVATORE DARIO",\n    "OBEDIENTE",\n    "SALVATORE DARIO",\n    "OBEDIENTE",\n    "SALVATORE DARIO",\n    "OBEDIENTE",\n    "SALVATORE DARIO",\n    "OBEDIENTE",\n    "SALVATORE DARIO",\n    "OBEDIENTE",\n    "SALVATORE DARIO",\n    "OBEDIENTE",\n    "SALVATORE DARIO",\n    "OBEDIENTE",\n    "SALVATORE DARIO",\n    "OBEDIENTE",\n    "SALVATORE DARIO",\n    "OBEDIENTE",\n    "SALVATORE DARIO",\n    "OBEDIENTE",\n    "SALVATORE DARIO",\n    "OBEDIENTE",\n    "SALVATORE DARIO",\n    "OBEDIENTE",\n    "SALVATORE DARIO",\n    "OBEDIENTE",\n    "SALVATORE DARIO",\n    "OBEDIENTE",\n    "SALVATORE DARIO",\n    "OBEDIENTE",\n    "SALVATORE DARIO",\n    "OBEDIENTE",\n    "SALVATORE DARIO",\n    "OBEDIENTE",\n    "SALVATORE DARIO",\n    "OBEDIENTE",\n    "SALVATORE DARIO",\n    "OBEDIENTE",\n    "SALVATORE DARIO",\n    "OBEDIENTE",\n    "SALVATORE DARIO",\n    "OBEDIENTE",\n    "SALVATORE DARIO",\n    "OBEDIENTE",\n    "SALVATORE DARIO",\n    "OBEDIENTE",\n    "SALVATORE DARIO",\n    "OBEDIENTE",\n    "SALVATORE DARIO",\n    "OBEDIENTE",\n    "S')
Traceback (most recent call last):
  File "/opt/tiger/visual-multi-agent-research/vmas_local_eval.py", line 380, in run_eval
    obs, cand, ver = chain.run_one(question, img_path, choices=choices)
                     ^^^^^^^^^^^^^^^^^^^^^^^^^^^^^^^^^^^^^^^^^^^^^^^^^^
  File "/opt/tiger/visual-multi-agent-research/chains/visual_chain.py", line 536, in run_one
    obs2 = self.observe(question, image_path, extra_focus=focus)
           ^^^^^^^^^^^^^^^^^^^^^^^^^^^^^^^^^^^^^^^^^^^^^^^^^^^^^
  File "/opt/tiger/visual-multi-agent-research/chains/visual_chain.py", line 471, in observe
    obs = call_structured_json(
          ^^^^^^^^^^^^^^^^^^^^^
  File "/opt/tiger/visual-multi-agent-research/chains/visual_chain.py", line 394, in call_structured_json
    raise RuntimeError(
RuntimeError: Failed to get valid JSON for schema=Observation. Last output:
{
  "objects": [
    {
      "label": "Relief sculpture",
      "attributes": {
        "material": ["bronze"],
        "style": ["medieval"],
        "subject": ["religious scene"]
      },
      "count": 1,
      "bbox_xyxy": [0, 0, 1119, 812],
      "relations": ["depicts religious figures", "showing crucifixion"],
      "bboxes_xyxy": []
    }
  ],
  "ocr_text_blocks": [
    "ANNO MILLENO CEISENO SEPTAGENO: OCVAO SCULBOR PATZISOXSEZDO",
    "GABRIELI",
    "SALVATORE DARIO",
    "OBEDIENTE",
    "SALVATORE DARIO",
    "OBEDIENTE",
    "SALVATORE DARIO",
    "OBEDIENTE",
    "SALVATORE DARIO",
    "OBEDIENTE",
    "SALVATORE DARIO",
    "OBEDIENTE",
    "SALVATORE DARIO",
    "OBEDIENTE",
    "SALVATORE DARIO",
    "OBEDIENTE",
    "SALVATORE DARIO",
    "OBEDIENTE",
    "SALVATORE DARIO",
    "OBEDIENTE",
    "SALVATORE DARIO",
    "OBEDIENTE",
    "SALVATORE DARIO",
    "OBEDIENTE",
    "SALVATORE DARIO",
    "OBEDIENTE",
    "SALVATORE DARIO",
    "OBEDIENTE",
    "SALVATORE DARIO",
    "OBEDIENTE",
    "SALVATORE DARIO",
    "OBEDIENTE",
    "SALVATORE DARIO",
    "OBEDIENTE",
    "SALVATORE DARIO",
    "OBEDIENTE",
    "SALVATORE DARIO",
    "OBEDIENTE",
    "SALVATORE DARIO",
    "OBEDIENTE",
    "SALVATORE DARIO",
    "OBEDIENTE",
    "SALVATORE DARIO",
    "OBEDIENTE",
    "SALVATORE DARIO",
    "OBEDIENTE",
    "SALVATORE DARIO",
    "OBEDIENTE",
    "SALVATORE DARIO",
    "OBEDIENTE",
    "SALVATORE DARIO",
    "OBEDIENTE",
    "SALVATORE DARIO",
    "OBEDIENTE",
    "SALVATORE DARIO",
    "OBEDIENTE",
    "SALVATORE DARIO",
    "OBEDIENTE",
    "SALVATORE DARIO",
    "OBEDIENTE",
    "SALVATORE DARIO",
    "OBEDIENTE",
    "SALVATORE DARIO",
    "OBEDIENTE",
    "SALVATORE DARIO",
    "OBEDIENTE",
    "SALVATORE DARIO",
    "OBEDIENTE",
    "SALVATORE DARIO",
    "OBEDIENTE",
    "SALVATORE DARIO",
    "OBEDIENTE",
    "SALVATORE DARIO",
    "OBEDIENTE",
    "SALVATORE DARIO",
    "OBEDIENTE",
    "SALVATORE DARIO",
    "OBEDIENTE",
    "S
[2025-12-23 02:41:18,758] INFO - >> [149/200] Start example=mme:148
[2025-12-23 02:41:30,349] INFO - << example=mme:148 ok=False verdict=FAIL pred=no gt=Yes
[2025-12-23 02:41:30,350] INFO - >> [150/200] Start example=mme:149
[2025-12-23 02:41:43,939] INFO - << example=mme:149 ok=True verdict=FAIL pred=no gt=No
[2025-12-23 02:41:43,939] INFO - >> [151/200] Start example=mme:150
[2025-12-23 02:41:48,409] INFO - << example=mme:150 ok=True verdict=PASS pred=yes gt=Yes
[2025-12-23 02:41:48,409] INFO - >> [152/200] Start example=mme:151
[2025-12-23 02:42:02,590] INFO - << example=mme:151 ok=True verdict=FAIL pred=no gt=No
[2025-12-23 02:42:02,590] INFO - >> [153/200] Start example=mme:152
[2025-12-23 02:42:16,546] INFO - << example=mme:152 ok=False verdict=FAIL pred=no gt=Yes
[2025-12-23 02:42:16,547] INFO - >> [154/200] Start example=mme:153
[2025-12-23 02:42:29,781] INFO - << example=mme:153 ok=True verdict=FAIL pred=no gt=No
[2025-12-23 02:42:29,781] INFO - >> [155/200] Start example=mme:154
[2025-12-23 02:42:43,131] INFO - << example=mme:154 ok=True verdict=PASS pred=yes gt=Yes
[2025-12-23 02:42:43,132] INFO - >> [156/200] Start example=mme:155
[2025-12-23 02:42:49,756] INFO - << example=mme:155 ok=True verdict=PASS pred=no gt=No
[2025-12-23 02:42:49,756] INFO - >> [157/200] Start example=mme:156
[2025-12-23 02:43:02,587] INFO - << example=mme:156 ok=False verdict=FAIL pred=no gt=Yes
[2025-12-23 02:43:02,587] INFO - >> [158/200] Start example=mme:157
[2025-12-23 02:43:16,545] INFO - << example=mme:157 ok=True verdict=FAIL pred=no gt=No
[2025-12-23 02:43:16,546] INFO - >> [159/200] Start example=mme:158
[2025-12-23 02:43:29,187] INFO - << example=mme:158 ok=False verdict=FAIL pred=no gt=Yes
[2025-12-23 02:43:29,188] INFO - >> [160/200] Start example=mme:159
[2025-12-23 02:43:42,656] INFO - << example=mme:159 ok=True verdict=FAIL pred=no gt=No
[2025-12-23 02:43:42,657] INFO - >> [161/200] Start example=mme:160
[2025-12-23 02:43:48,314] INFO - << example=mme:160 ok=True verdict=PASS pred=yes gt=Yes
[2025-12-23 02:43:48,314] INFO - >> [162/200] Start example=mme:161
[2025-12-23 02:44:02,259] INFO - << example=mme:161 ok=True verdict=FAIL pred=no gt=No
[2025-12-23 02:44:02,259] INFO - >> [163/200] Start example=mme:162
[2025-12-23 02:44:06,764] INFO - << example=mme:162 ok=True verdict=PASS pred=yes gt=Yes
[2025-12-23 02:44:06,764] INFO - >> [164/200] Start example=mme:163
[2025-12-23 02:44:18,817] INFO - << example=mme:163 ok=True verdict=FAIL pred=no gt=No
[2025-12-23 02:44:18,817] INFO - >> [165/200] Start example=mme:164
[2025-12-23 02:44:23,500] INFO - << example=mme:164 ok=True verdict=PASS pred=yes gt=Yes
[2025-12-23 02:44:23,500] INFO - >> [166/200] Start example=mme:165
[2025-12-23 02:44:34,321] INFO - << example=mme:165 ok=True verdict=FAIL pred=no gt=No
[2025-12-23 02:44:34,321] INFO - >> [167/200] Start example=mme:166
[2025-12-23 02:44:46,215] INFO - << example=mme:166 ok=False verdict=FAIL pred=no gt=Yes
[2025-12-23 02:44:46,215] INFO - >> [168/200] Start example=mme:167
[2025-12-23 02:44:56,882] INFO - << example=mme:167 ok=True verdict=FAIL pred=no gt=No
[2025-12-23 02:44:56,911] INFO - >> [169/200] Start example=mme:168
[2025-12-23 02:45:02,301] INFO - << example=mme:168 ok=True verdict=PASS pred=yes gt=Yes
[2025-12-23 02:45:02,301] INFO - >> [170/200] Start example=mme:169
[2025-12-23 02:45:07,014] INFO - << example=mme:169 ok=True verdict=PASS pred=no gt=No
[2025-12-23 02:45:07,015] INFO - >> [171/200] Start example=mme:170
[2025-12-23 02:45:31,363] INFO - << example=mme:170 ok=False verdict=FAIL pred=no gt=Yes
[2025-12-23 02:45:31,363] INFO - >> [172/200] Start example=mme:171
[2025-12-23 02:45:46,000] INFO - << example=mme:171 ok=True verdict=FAIL pred=no gt=No
[2025-12-23 02:45:46,001] INFO - >> [173/200] Start example=mme:172
[2025-12-23 02:45:50,391] INFO - << example=mme:172 ok=True verdict=PASS pred=yes gt=Yes
[2025-12-23 02:45:50,391] INFO - >> [174/200] Start example=mme:173
[2025-12-23 02:46:01,137] INFO - << example=mme:173 ok=True verdict=FAIL pred=no gt=No
[2025-12-23 02:46:01,138] INFO - >> [175/200] Start example=mme:174
[2025-12-23 02:46:15,485] INFO - << example=mme:174 ok=True verdict=PASS pred=yes gt=Yes
[2025-12-23 02:46:15,485] INFO - >> [176/200] Start example=mme:175
[2025-12-23 02:46:19,524] INFO - << example=mme:175 ok=True verdict=PASS pred=no gt=No
[2025-12-23 02:46:19,525] INFO - >> [177/200] Start example=mme:176
[2025-12-23 02:46:30,531] INFO - << example=mme:176 ok=False verdict=FAIL pred=no gt=Yes
[2025-12-23 02:46:30,531] INFO - >> [178/200] Start example=mme:177
[2025-12-23 02:46:43,395] INFO - << example=mme:177 ok=True verdict=FAIL pred=no gt=No
[2025-12-23 02:46:43,396] INFO - >> [179/200] Start example=mme:178
[2025-12-23 02:46:57,928] INFO - << example=mme:178 ok=False verdict=FAIL pred=no gt=Yes
[2025-12-23 02:46:57,929] INFO - >> [180/200] Start example=mme:179
[2025-12-23 02:47:09,155] INFO - << example=mme:179 ok=True verdict=FAIL pred=no gt=No
[2025-12-23 02:47:09,155] INFO - >> [181/200] Start example=mme:180
[2025-12-23 02:47:13,924] INFO - << example=mme:180 ok=True verdict=PASS pred=yes gt=Yes
[2025-12-23 02:47:13,924] INFO - >> [182/200] Start example=mme:181
[2025-12-23 02:47:26,128] INFO - << example=mme:181 ok=True verdict=FAIL pred=no gt=No
[2025-12-23 02:47:26,128] INFO - >> [183/200] Start example=mme:182
[2025-12-23 02:47:29,552] INFO - << example=mme:182 ok=True verdict=PASS pred=yes gt=Yes
[2025-12-23 02:47:29,552] INFO - >> [184/200] Start example=mme:183
[2025-12-23 02:47:41,844] INFO - << example=mme:183 ok=False verdict=FAIL pred=yes gt=No
[2025-12-23 02:47:41,845] INFO - >> [185/200] Start example=mme:184
[2025-12-23 02:47:51,311] INFO - << example=mme:184 ok=False verdict=FAIL pred=no gt=Yes
[2025-12-23 02:47:51,311] INFO - >> [186/200] Start example=mme:185
[2025-12-23 02:48:01,905] INFO - << example=mme:185 ok=True verdict=FAIL pred=no gt=No
[2025-12-23 02:48:01,905] INFO - >> [187/200] Start example=mme:186
[2025-12-23 02:48:08,142] INFO - << example=mme:186 ok=True verdict=PASS pred=yes gt=Yes
[2025-12-23 02:48:08,143] INFO - >> [188/200] Start example=mme:187
[2025-12-23 02:48:21,658] INFO - << example=mme:187 ok=True verdict=FAIL pred=no gt=No
[2025-12-23 02:48:21,658] INFO - >> [189/200] Start example=mme:188
[2025-12-23 02:48:26,286] INFO - << example=mme:188 ok=True verdict=PASS pred=yes gt=Yes
[2025-12-23 02:48:26,286] INFO - >> [190/200] Start example=mme:189
[2025-12-23 02:48:38,695] INFO - << example=mme:189 ok=True verdict=FAIL pred=no gt=No
[2025-12-23 02:48:38,695] INFO - >> [191/200] Start example=mme:190
[2025-12-23 02:48:44,395] INFO - << example=mme:190 ok=False verdict=PASS pred=no gt=Yes
[2025-12-23 02:48:44,395] INFO - >> [192/200] Start example=mme:191
[2025-12-23 02:48:55,790] INFO - << example=mme:191 ok=True verdict=FAIL pred=no gt=No
[2025-12-23 02:48:55,790] INFO - >> [193/200] Start example=mme:192
[2025-12-23 02:49:02,021] INFO - << example=mme:192 ok=True verdict=PASS pred=yes gt=Yes
[2025-12-23 02:49:02,021] INFO - >> [194/200] Start example=mme:193
[2025-12-23 02:49:12,990] INFO - << example=mme:193 ok=True verdict=FAIL pred=no gt=No
[2025-12-23 02:49:12,991] INFO - >> [195/200] Start example=mme:194
[2025-12-23 02:49:19,209] INFO - << example=mme:194 ok=True verdict=PASS pred=yes gt=Yes
[2025-12-23 02:49:19,210] INFO - >> [196/200] Start example=mme:195
[2025-12-23 02:49:32,306] INFO - << example=mme:195 ok=True verdict=FAIL pred=no gt=No
[2025-12-23 02:49:32,307] INFO - >> [197/200] Start example=mme:196
[2025-12-23 02:49:46,094] INFO - << example=mme:196 ok=False verdict=FAIL pred=no gt=Yes
[2025-12-23 02:49:46,095] INFO - >> [198/200] Start example=mme:197
[2025-12-23 02:49:57,191] INFO - << example=mme:197 ok=True verdict=FAIL pred=no gt=No
[2025-12-23 02:49:57,191] INFO - >> [199/200] Start example=mme:198
[2025-12-23 02:50:01,655] INFO - << example=mme:198 ok=True verdict=PASS pred=yes gt=Yes
[2025-12-23 02:50:01,655] INFO - >> [200/200] Start example=mme:199
[2025-12-23 02:50:14,570] INFO - << example=mme:199 ok=True verdict=FAIL pred=no gt=No
[2025-12-23 02:50:14,571] INFO - ============================================================
[2025-12-23 02:50:14,571] INFO - Summary
[2025-12-23 02:50:14,571] INFO - cmd: eval-mme
[2025-12-23 02:50:14,571] INFO - model: Qwen/Qwen2.5-VL-7B-Instruct
[2025-12-23 02:50:14,571] INFO - dataset_id: lmms-lab/MME
[2025-12-23 02:50:14,571] INFO - split: test
[2025-12-23 02:50:14,571] INFO - limit: 200
[2025-12-23 02:50:14,571] INFO - start_time: 2025-12-23T02:09:18.948082
[2025-12-23 02:50:14,571] INFO - end_time: 2025-12-23T02:50:14.570887
[2025-12-23 02:50:14,571] INFO - output_dir: output/eval-mme_Qwen2.5-VL-7B-Instruct2
[2025-12-23 02:50:14,571] INFO - predictions_file: output/eval-mme_Qwen2.5-VL-7B-Instruct2/predictions.jsonl
[2025-12-23 02:50:14,571] INFO - total: 196
[2025-12-23 02:50:14,571] INFO - correct: 137
[2025-12-23 02:50:14,571] INFO - accuracy: 0.6989795918367347
[2025-12-23 02:50:14,571] INFO - choice_mapping_failures: 0
[2025-12-23 02:50:14,571] INFO - errors: 4
[2025-12-23 02:50:14,571] INFO - resume_enabled: False
[2025-12-23 02:50:14,572] INFO - ============================================================
